{
  "schema_version": 1,
  "registered": false,
  "target_execution_authorized": false,
  "selected_target_ids": [],
  "targets_run": 0,
  "targets": [
    {
      "id": "SU2:g=0.125:eta=0",
      "status": "unrun",
      "result": null
    },
    {
      "id": "SU2:g=0.125:eta=0.5",
      "status": "unrun",
      "result": null
    },
    {
      "id": "SU2:g=0.125:eta=1",
      "status": "unrun",
      "result": null
    },
    {
      "id": "SU2:g=0.25:eta=0",
      "status": "unrun",
      "result": null
    },
    {
      "id": "SU2:g=0.25:eta=0.5",
      "status": "unrun",
      "result": null
    },
    {
      "id": "SU2:g=0.25:eta=1",
      "status": "unrun",
      "result": null
    },
    {
      "id": "SU2:g=0.40:eta=0",
      "status": "unrun",
      "result": null
    },
    {
      "id": "SU2:g=0.40:eta=0.5",
      "status": "unrun",
      "result": null
    },
    {
      "id": "SU2:g=0.40:eta=1",
      "status": "unrun",
      "result": null
    },
    {
      "id": "SU2:g=0.60:eta=0",
      "status": "unrun",
      "result": null
    },
    {
      "id": "SU2:g=0.60:eta=0.5",
      "status": "unrun",
      "result": null
    },
    {
      "id": "SU2:g=0.60:eta=1",
      "status": "unrun",
      "result": null
    },
    {
      "id": "SU2:g=0.85:eta=0",
      "status": "unrun",
      "result": null
    },
    {
      "id": "SU2:g=0.85:eta=0.5",
      "status": "unrun",
      "result": null
    },
    {
      "id": "SU2:g=0.85:eta=1",
      "status": "unrun",
      "result": null
    },
    {
      "id": "SU2:g=1.25:eta=0",
      "status": "unrun",
      "result": null
    },
    {
      "id": "SU2:g=1.25:eta=0.5",
      "status": "unrun",
      "result": null
    },
    {
      "id": "SU2:g=1.25:eta=1",
      "status": "unrun",
      "result": null
    },
    {
      "id": "SU2:g=2.50:eta=0",
      "status": "unrun",
      "result": null
    },
    {
      "id": "SU2:g=2.50:eta=0.5",
      "status": "unrun",
      "result": null
    },
    {
      "id": "SU2:g=2.50:eta=1",
      "status": "unrun",
      "result": null
    },
    {
      "id": "U1:g=0.125:eta=0",
      "status": "unrun",
      "result": null
    },
    {
      "id": "U1:g=0.125:eta=0.5",
      "status": "unrun",
      "result": null
    },
    {
      "id": "U1:g=0.125:eta=1",
      "status": "unrun",
      "result": null
    },
    {
      "id": "U1:g=0.25:eta=0",
      "status": "unrun",
      "result": null
    },
    {
      "id": "U1:g=0.25:eta=0.5",
      "status": "unrun",
      "result": null
    },
    {
      "id": "U1:g=0.25:eta=1",
      "status": "unrun",
      "result": null
    },
    {
      "id": "U1:g=0.40:eta=0",
      "status": "unrun",
      "result": null
    },
    {
      "id": "U1:g=0.40:eta=0.5",
      "status": "unrun",
      "result": null
    },
    {
      "id": "U1:g=0.40:eta=1",
      "status": "unrun",
      "result": null
    },
    {
      "id": "U1:g=0.60:eta=0",
      "status": "unrun",
      "result": null
    },
    {
      "id": "U1:g=0.60:eta=0.5",
      "status": "unrun",
      "result": null
    },
    {
      "id": "U1:g=0.60:eta=1",
      "status": "unrun",
      "result": null
    },
    {
      "id": "U1:g=0.85:eta=0",
      "status": "unrun",
      "result": null
    },
    {
      "id": "U1:g=0.85:eta=0.5",
      "status": "unrun",
      "result": null
    },
    {
      "id": "U1:g=0.85:eta=1",
      "status": "unrun",
      "result": null
    },
    {
      "id": "U1:g=1.25:eta=0",
      "status": "unrun",
      "result": null
    },
    {
      "id": "U1:g=1.25:eta=0.5",
      "status": "unrun",
      "result": null
    },
    {
      "id": "U1:g=1.25:eta=1",
      "status": "unrun",
      "result": null
    },
    {
      "id": "U1:g=2.50:eta=0",
      "status": "unrun",
      "result": null
    },
    {
      "id": "U1:g=2.50:eta=0.5",
      "status": "unrun",
      "result": null
    },
    {
      "id": "U1:g=2.50:eta=1",
      "status": "unrun",
      "result": null
    }
  ],
  "protocol": {
    "SU2_cutoffs": [
      20,
      40,
      80,
      160,
      320
    ],
    "U1_cutoffs": [
      40,
      80,
      160,
      320,
      640
    ],
    "grids": [
      600,
      1200,
      2400,
      4800
    ],
    "tau": [
      "0",
      "1/8",
      "1/4",
      "1/2",
      "1",
      "2",
      "4",
      "8",
      "12",
      "16",
      "20",
      "24"
    ],
    "tolerances": [
      [
        1e-08,
        1e-18
      ],
      [
        1e-10,
        1e-20
      ]
    ],
    "moment_absolute_budget": "1/1000000",
    "gap_relative_budget": "1/1000000",
    "scalar_consistency_tolerance": "1/1000000000",
    "clock_rule": "binary64-rounded tau / minimum accessible-gap midpoint at finest certificate",
    "window_reporting": "retain every adjacent pair and all common qualifying pairs at finest grid and tighter tolerance; no result-dependent extension",
    "control_rule": "replay all four pinned analytic/representation suites before requested cells; any failed control prevents execution",
    "failure_rule": "retain every requested rung and tolerance; no finest-failure fallback; preserve partial evidence; insufficient precision is unresolved; failed controls or source/accounting drift invalidate success",
    "deformation_comparison": "matched theory and g: subtract component intervals [a,b]-[c,d]=[a-d,b-c]; retain overlap uncertainty; no mechanism or continuum claim"
  },
  "environment": {
    "python": "3.10.12",
    "implementation": "CPython",
    "packages": {
      "numpy": "2.2.6",
      "scipy": "1.15.3",
      "jsonschema": "4.26.0",
      "jsonpointer": "2.0",
      "referencing": "0.37.0",
      "rpds-py": "0.30.0",
      "attrs": "26.1.0",
      "jsonschema-specifications": "2025.9.1",
      "typing-extensions": "4.15.0"
    }
  },
  "source_sha256": {
    "research/vacuum-spectrum/design-bundle/notes/ym_vacuum_gap_registration_draft.md": "dc01a22a08d8c3edd0228740fa43723dcff5e3db424a030c5bce84fa51d0fc86",
    "research/vacuum-spectrum/future-stage-input.schema.json": "e14add22de3a64f953e4422a2a8be3575c3efa842488f93d0b700b04f604b187",
    "research/vacuum-spectrum/run-envelope.schema.json": "f0a75bfe175e10c18e508286b8fa2f2df062a23d25e0f3f41d2db1e241f5ed2c",
    "scripts/vacuum_angle_refined.py": "112a7eade8384a76b66816454a2a7da774035d6ba81f2c324383ce39ef914265",
    "scripts/vacuum_certificate_run.py": "a13d5b65c75c5949b6a83d4ef773b88568b5fde37f01e85598dcf3d83e25e75e",
    "scripts/vacuum_certified.py": "c13ae2dcbcc197104e4e5ad98bb5e1899b229857edf2ad4a94169059768501e1",
    "scripts/vacuum_channel_contract.py": "dbd7f8baa2cd04a51dbef164616f2051362465ef8dbd9603a7f575e5091ea540",
    "scripts/vacuum_convergence.py": "3b1d034fd40dc9d2c42448af046a492ec0e9b02058f81dd4746e9d40cbc2f552",
    "scripts/vacuum_design_nulls.py": "5433a0a284e105d9875fe7768f65c62953649d79ebd47a7d52ab63e87580a5e7",
    "scripts/vacuum_development.py": "1983126d88bbec6d609d116bf6b6b9db7d2ff305a965ba2fb6e4a3bf0cc4fa8c",
    "scripts/vacuum_future_adapter.py": "383d679b64b7fd668f83232541a8e88eac961d03cca645300eb2906c6ad4aa09",
    "scripts/vacuum_intervals.py": "f5fc61ac448fa11156333fca0a6a82b16d125791982efc93cdef7d83d49e8988",
    "scripts/vacuum_null_controls.py": "648fce648f2f53cc0ebc42b956b8f9d58ac88dfed828926b6a986610f0a451f1",
    "scripts/vacuum_parameterized_certificate.py": "9698b3946593f11f18d568a394a2060b7ed3df2f8ecc78d82864b8c7b24e83bc",
    "scripts/vacuum_parameterized_scalar.py": "0adde566726765f0e5fb3d12d0b3da1012ea80cccf925a648a36524bccdccc1e",
    "scripts/vacuum_parameterized_temporal.py": "a591c8d36d56559589cdbc599790b13c443c3c121726185871f89873c54b531a",
    "scripts/vacuum_preflight.py": "4a993f491fce26e0f1793b4e2d099b4caded8ae298bfa14bc3527ab0af1d858c",
    "scripts/vacuum_refinement.py": "cdcb8e4147e46f84e841ff9c334602cb0cf7e3be92375c59218f41bb4d5d5cdf",
    "scripts/vacuum_result_contract.py": "fb737121bc07c6ce48abe7e0c37cdd212728251391f4e6ab74a101baa75aecc2",
    "scripts/vacuum_run_envelope.py": "f40a2ddec9745b636bbc7fecc0679c2f29deaa65098ca56f27c71fd8d3dbd80b",
    "scripts/vacuum_semigroup.py": "063546b2a7c8e4a2781c31015a2870dde84525b091d342077c3cf056c31d4519",
    "scripts/vacuum_semigroup_run.py": "fce28929e0b578a6696de956e2b250c66564d00d5b0fae1eb176bebe21958882",
    "scripts/vacuum_temporal_replay.py": "978aa035ebc77afdcf3a40e87a32a1ef13d1ab62afd4f46352cab519abc48590",
    "scripts/vacuum_time_windows.py": "303e43fa4e55aaba658930f9d6537d0951807db819fefbf0041e2ea323d5d1ff",
    "scripts/vacuum_u1.py": "a3198acf0a3c6f54f01467f61db1bbacbe454451fc9f762af7eda2902e671686",
    "scripts/vacuum_u1_certified.py": "a8443d42fb41cda94bdcea6c4213632926ce8b74ca4feca68c393328fa115109",
    "scripts/vacuum_u1_design.py": "4bd5288e371d1476ae4e2f06f4248ae01a4240d2f08a007e59bf13ad869241d0",
    "scripts/vacuum_u1_design_certified.py": "5d28ff695e5213121c1a3240c4b35065f21e14677305c63a0bd3da3affc26f48",
    "scripts/vacuum_u1_design_run.py": "51ba26f6de1889374c96bb8737d4a02b5ec701474a92802e6ca2660b26a6f3d5",
    "scripts/vacuum_execution_contract.py": "364f32ec999c10c6ffce3880c7f3296e85940b32c965a2d09579b3499c92cd75",
    "research/vacuum-spectrum/execution-contract.schema.json": "b1f0e71daf78f606f7f3f422b304c09947b18b6321b46aeaef293c5c74f1e1a9",
    "research/vacuum-spectrum/requirements.txt": "4b81b6b6a549771115529e6900b9589835cdbfff0c6acf179aef53d283b744d5",
    "research/vacuum-spectrum/requirements-readiness.txt": "58d8f0ad48e3d2ad33d88188a694b9dd442577eaaa6873ccbcf25c31ea1d6ed1"
  }
}
